{
  "schema_version": "revoot.evaluation-scenario/v1",
  "case_id": "principles/duplication-with-security-consequence",
  "sequence_id": null,
  "revision": 1,
  "clean_change": false,
  "base_sha": "7070707070707070707070707070707070707070",
  "start_sha": "8080808080808080808080808080808080808080",
  "head_sha": "9090909090909090909090909090909090909090",
  "old_path": "src/export.rs",
  "new_path": "src/export.rs",
  "change_kind": "modified",
  "exact_diff": "@@ -1,3 +1,3 @@\n pub fn authorize_export(user: &User, report: &Report) -> bool {\n-    crate::policy::may_export(user, report)\n+    user.active\n }\n",
  "checkout_files": {
    "Cargo.toml": "[package]\nname = \"reports\"\nversion = \"0.1.0\"\nedition = \"2024\"\n",
    "src/export.rs": "pub fn authorize_export(user: &User, report: &Report) -> bool {\n    user.active\n}\n",
    "src/policy.rs": "pub fn may_export(user: &User, report: &Report) -> bool {\n    user.active && user.tenant_id == report.tenant_id\n}\n"
  },
  "expected_defects": [
    {
      "side": "new",
      "line": 2,
      "category": "security"
    }
  ]
}
