{
  "schema_version": "revoot.evaluation-scenario/v1",
  "case_id": "rust/clean-refactor",
  "sequence_id": null,
  "revision": 1,
  "clean_change": true,
  "base_sha": "1111111111111111111111111111111111111111",
  "start_sha": "2222222222222222222222222222222222222222",
  "head_sha": "3333333333333333333333333333333333333333",
  "old_path": "src/lib.rs",
  "new_path": "src/lib.rs",
  "change_kind": "modified",
  "exact_diff": "@@ -1,4 +1,4 @@\n pub fn active_names(names: &[String]) -> Vec<&str> {\n-    let result = names.iter().map(String::as_str).collect();\n-    result\n+    let active = names.iter().map(String::as_str).collect();\n+    active\n }\n",
  "checkout_files": {
    "Cargo.toml": "[package]\nname = \"names\"\nversion = \"0.1.0\"\nedition = \"2024\"\n",
    "src/lib.rs": "pub fn active_names(names: &[String]) -> Vec<&str> {\n    let active = names.iter().map(String::as_str).collect();\n    active\n}\n"
  },
  "expected_defects": []
}
