{
  "schema_version": "revoot.evaluation-scenario/v1",
  "case_id": "principles/dry-duplication-without-consequence",
  "sequence_id": null,
  "revision": 1,
  "clean_change": true,
  "base_sha": "1010101010101010101010101010101010101010",
  "start_sha": "2020202020202020202020202020202020202020",
  "head_sha": "3030303030303030303030303030303030303030",
  "old_path": "src/ports.rs",
  "new_path": "src/ports.rs",
  "change_kind": "modified",
  "exact_diff": "@@ -1,3 +1,7 @@\n pub fn normalize_port(port: u16) -> u16 {\n     if port == 0 { 80 } else { port }\n }\n+\n+pub fn normalize_proxy_port(port: u16) -> u16 {\n+    if port == 0 { 80 } else { port }\n+}\n",
  "checkout_files": {
    "Cargo.toml": "[package]\nname = \"ports\"\nversion = \"0.1.0\"\nedition = \"2024\"\n",
    "src/ports.rs": "pub fn normalize_port(port: u16) -> u16 {\n    if port == 0 { 80 } else { port }\n}\n\npub fn normalize_proxy_port(port: u16) -> u16 {\n    if port == 0 { 80 } else { port }\n}\n"
  },
  "expected_defects": []
}
