{
  "schema_version": "revoot.evaluation-scenario/v1",
  "case_id": "python/security-shell-injection",
  "sequence_id": null,
  "revision": 1,
  "clean_change": false,
  "base_sha": "1111111111111111111111111111111111111111",
  "start_sha": "2222222222222222222222222222222222222222",
  "head_sha": "4444444444444444444444444444444444444444",
  "old_path": "app/archive.py",
  "new_path": "app/archive.py",
  "change_kind": "modified",
  "exact_diff": "@@ -1,3 +1,3 @@\n import subprocess\n def archive(user_path: str) -> None:\n-    subprocess.run([\"tar\", \"-czf\", \"backup.tgz\", user_path], check=True)\n+    subprocess.run(f\"tar -czf backup.tgz {user_path}\", shell=True, check=True)\n",
  "checkout_files": {
    "app/archive.py": "import subprocess\ndef archive(user_path: str) -> None:\n    subprocess.run(f\"tar -czf backup.tgz {user_path}\", shell=True, check=True)\n",
    "app/routes.py": "from .archive import archive\ndef upload(request):\n    archive(request.form[\"path\"])\n"
  },
  "expected_defects": [
    { "side": "new", "line": 3, "category": "security" }
  ]
}
